{
  "aws_calls_performed": 0,
  "aws_mutations": 0,
  "completion_package_digest": "sha256:98894fd8bdfe02a16234ee5a0de786f1f3f5d761c28a990ef0fba4ef4a9b7fc1",
  "consumer_fresh_checkpoint_required": true,
  "consumer_issue": "GUG-365",
  "deployment_authorized": false,
  "evidence_scope": "REPOSITORY_VALIDATED_SYNTHETIC_ONLY",
  "gug206_effects": 0,
  "gug215_effects": 0,
  "gug357_effects": 0,
  "gug365_effects": 0,
  "handoff_digest": "sha256:a594cad8095af4f4c32d9b7616100c6d72fc5cbb75401770c5320e11197f8834",
  "implementation_issue": "GUG-377",
  "independent_approval_present": false,
  "inventory_digest": "sha256:950d4faf5700914ba79d31b8b04a9b1d9455ae1847aa85a5943645322064cea7",
  "live_provider_evidence": false,
  "live_signing_job_count": 0,
  "missing_live_prerequisites": [
    "LIVE_PRIVATE_ORCHESTRATOR"
  ],
  "plan_digest": "sha256:e7abd7bc04314be7e9541ba00d0a5b78e66746a48950d2f845cd6e16391bdef8",
  "production": false,
  "provider_certification_complete": false,
  "provider_network_calls": 0,
  "record_type": "scanalyze.platform_authority.gug365_upstream_final_handoff.v2",
  "rollback_package_digest": "sha256:88ffafc9efc85b8944cb6ca0310192b9eb6dcfdd8beed029917b7a8a502b9b36",
  "schema_version": 2,
  "source_contracts_closed": true,
  "state": "SOURCE_CONTRACTS_CLOSED_REPOSITORY_ONLY",
  "status": "STOP_LIVE_ORCHESTRATOR_NOT_IMPLEMENTED",
  "synthetic_materialization_complete": true,
  "synthetic_signing_job_count": 2,
  "two_human_status": "NOT_PROVEN",
  "upstream_contract_issue": "GUG-376"
}
